Nombre,Bares,Seguridad,Act Impacto, Policia, Salud, Cultura, Deporte, Total
INST PEDAG PARA EL DESARROLLO INTEGRAL CREAR,4.25,8.45,10.0,2.5,10.0,8.25,7.75,7.314285714285715
COL DIST BENJAMIN HERRERA,3.75,9.0,8.0,5.0,8.25,10.0,6.5,7.214285714285714
CENT EDUC DIST EL JAZMIN,9.0,7.45,10.0,0.0,9.25,10.0,7.5,7.6000000000000005
COL DIST LUIS CARLOS GALAN SARMIENTO,9.5,7.44,10.0,1.0,9.0,9.95,5.75,7.5200000000000005
CENT EDUC DIST ANTONIO JOSE DE SUCRE,8.0,6.8,10.0,1.0,10.0,6.050000000000001,8.75,7.228571428571428